review_id,title,year,user_review,user_suggestion,emotion
846,WARMODE,2017,"Early Access ReviewThis game is amazing for a free game, I would really see the expansion of this game so like DLC extra maps But no exo or spully drops and if you are going to buy a gun please no so you have to keep paying so you can keep the gun",1,enthusiasm
847,WARMODE,2015,"Early Access ReviewFantastic potential. Really fun to play, just join a game, earn points for kills and use points to buy guns and armour in that game. Hope the gun balancing stays the same and they dont implement a pay to win policy on the guns. Fingers crossed. Could do with some bigger maps and a bit stricter policing of hackers, which often ruin multiple games in a row. That said it's free, it's fun and it's definately worth a try.",1,fun
848,WARMODE,2016,"Early Access ReviewThe game wont launch. Stuck at ""Loading 76%"" for 15 minutes......  like the lady said: ""Aint nobody got time for that!!""  google it,  if you dont understand the reference   LMAO!",0,boredom
849,WARMODE,2017,Early Access ReviewI need Help.I download the Game but in every lobby i join in im lagging as ♥♥♥♥! >:(I tried to join other lobbys but im always lagging and i dont know why...Waiting for Response pls!,1,neutral
850,WARMODE,2016,"Early Access ReviewIs it a good looking game? No.Does it play well? Kind of.Is it sure hell funny and ridiculous. YES!!!Edit: For all of the salty people in the reviews complaining about the hackers, just note that this game is free and that you don't have to play it.",1,neutral
851,WARMODE,2017,"Early Access ReviewFun game. However I have only played at 6 in the morning and the hackers probably aren't on yet so I'll give it another go and see if I can get in a good game later and then I'll edit this post. I did run into a few but they didn't stay in the servers for more than 1-2 games so I was able to have fun. This game is gr8 for people like me who just wanna point and click.EDIT : I found that even with the more hackers playing at noon,  the game is still enjoyable, and + there's also more non-hackers at noon. Honestly most people just don't know how to kick, it's fairly easy to get hackers out of your game. You just hit ESC click on vote, and select the hacker's/hackers' name and click select. Boom, problem solved.",1,fun
852,WARMODE,2016,"Early Access ReviewIt's very rare that I am unable to have at the very least a single praise for a game I don't like. Wow where to begin with this hot mess of a game.....I mean this game is bad and I mean REALLY BAD! The map designs feel like someone is just painting by the numbers adding in only the most basic and mundane boring, bland landscape imaginable. Oh let's not forget when I logged in for the very first time, I received a machine gun volley of invites from every single random person imaginable. I literally got 35 invites within the first minute of logging in which was enragingly annoying. I could not find the settings menu fast enough to turn off notifications. An option such as that should be turned off by default seeing how a new player could get spammed into the ground with invites before they even put their foot in the door. My gosh never has a game had such atrocious hit detection/registry in all my years of gaming. Aiming in this game is a bad joke and attempting to aim with ironsights is just dogs***. I lined up a target in my ironsights, took precise aim at my oppenent's head and opened fire like crazy only to find out I DID NOT HIT HIM ONCE! So throughout the match I sat there trying to figure out where the hit detection/registry allowed me to damage my opponents. And of all the ridiculous solutions I've found this has got to be the worst. I found out how to make headshots in this game using ironsights. The trick is you don't aim for their head when trying to make a headshot (I know I'm just as confused and surprised as you are by that fact). You aim either at their crotch or the center of your opponent's chest to make headshots which is a**backwards and makes no sense what so ever.And then there is the blatant hacking in this game in which I gotta say wow. People who hack in this game are WAY TOO COMFORTABLE in cheating. From what I've seen these hackers walk around like ""Yeah I'm cheating....The f*** you gonna do about it?!"" In some instances they don't even try to hide the fact that they are cheating which is amazing in a depressing kind of way. Noticed a guy on my team straight destroying people on the other team with just a handgun all the way on the other side of the map. Not saying such a thing is impossible but to have such a high kill count with just a handgun shooting at extreme distances is not something a person can pull off constantly without cheating. But not to worry the other team had their own hacker(s) as well so I guess the equation balanced itself out in a kind of psychotic way. Shame on me for not noticing this sooner. I get rushed by a guy with a shotgun and realize that NOT ONCE during the entire match has he reloaded or ran out of ammo as he is rampaging around the map which is rather suspect if you ask me. This game basically took all the elements people enjoy in shooter games and combined them together but their execution in designing around these concepts was done in a very mediocre manner. The problem with the designers is that they don't have a clear understanding of why people like or even enjoy these particular elements in the gameplay. I can only tell you about my personal experience and opinion with the game so if you're feeling brave enough to play for yourself (Who knows you miles may vary)",0,anger
853,WARMODE,2015,"Early Access ReviewI really think this game is a lot of fun and that is has potential. I'm really surprised that this game has made it this far into development. Though there are bugs in the game, there are very minimal and are extremely rare to come across. When I started playing the early build of this game, I started to encounter hackers in the game, but as the game progresses in development, I started to see less and less. This shows me how much time and effort is being put into the game to make it enjoyable for everyone. I approve this game and can't wait for it to become out of its beta stage and be set to go into the actual steam store page listed not as an early access beta, but as an actual free-to-play game.",1,enthusiasm
854,WARMODE,2017,"Early Access ReviewThis game is like fast food.It's bad for you, but it's addictive... the negatives are:>UI is a bit sh*t>Ton of hackers>Soundtrack can get really annoying>Not a lot of mapsNeutral (Not bd, nor good)>Mechanics are meh.>Weapons aren't great>Leveling doesn't make that much sensePositive:>Doesn't take up much memory>Graphics are better than expected",1,happiness
855,WARMODE,2015,"Early Access ReviewThis game might need some work but it has potential, the ambiance and maps are really enjoyable, the counter strike based system looks fine at the moment and the weapon variety looks good too (of course there is never too much weapons and would be amazing to see more), the community is hard to know how is it, it seems kind of aggresive but the most part of them speak russian so it's hard to know for me, the masks thing is also good, if eventually a custom mask option comes out, maybe not now and not soon but eventually, well that would be ok.and about optimization well there you have the required specs, around 300MB and 1gb ram, not bad tho, even so i can't play in my potato but well even so i enjoyed the game.",1,happiness
856,WARMODE,2015,"Early Access ReviewGame sucks because when i started the game it went to a screen that said _Authorization and it just stayed there  10/10 would sit at a ""loading"" screen for 10 million years again",0,anger
857,WARMODE,2015,Early Access ReviewThis game has a long way to go untill it achieves it's full potential but I still like it. I predict a good future if devs dont follow the steps of other 'free' fps games with p2w aspect.,1,enthusiasm
858,WARMODE,2016,"Product received for freeEarly Access ReviewVery good game, Much like Call Of Duty but still a lot of skill involved. If this game keeps updating and getting better this could be a big game",1,happiness
859,WARMODE,2015,"Early Access Reviewwow just...... i cannot belive this♥♥♥♥♥♥.... i mean... rly? if you are too lazy to create a ♥♥♥♥ing game you have to steal it from the second most popular game on steam??? ♥♥♥♥ing siriously, i found about 5 different maps coppied off of cs:go, and its just a ♥♥♥♥ing reskin of cs in general: buy menue, the maps, some guns. And it also coppies some of call of duty's style. WHYYYYYYYYYYYYYYYYYYYYYYYYYYYYYYYYYYYYYYYYYYYYYYYYYYYYYYYYYYYYYYYYYYYYYYYYYYYYYYYYYYYYY?the game feel is pure trash and yes i know its in early access but it shouldent even be on the store. use your own damn maps, and textures. dont steal someone else's",0,anger
860,WARMODE,2015,Early Access ReviewThis game is fun to an extent but some of your deaths will leave you scratching your head. I enjoy the fast pace but not the b.s. I quit playing COD for a reason.,0,anger
861,WARMODE,2016,"Early Access ReviewMy most favoured (hated) game :D It's fabulousness (ugliness) and originality (yeah, originality my♥♥♥♥♥ just shine through the heavens (deepests of♥♥♥♥♥holes). It is fully recommended (NOT) to get this beautiful (ugly as fk) game.  It only costs 0 Dollars!(I want  my 0 dollars back). When you are banned (put out of misery), then don't worry! (or just leave this game lmao) just spend over 600 dollars to unban yourself! (don't) seems legit yes?100050352405802439683409654 million quadrillion vigintillion million trillion/ 10Would Spend 600+ dollars again",1,happiness
862,WARMODE,2018,"Early Access ReviewRussian attempt at making basic counter strike clone. It is a bit unusual since it isnt p2w, but it misses core mechanics and anticheat. Menu is basically just a server list and a shop with real cash only skins. These have weird level requirement, but its easy to reach it. Skins go from 50 cents up to 3.5 dollars for the highest level skins. Skins look kind of decent even if they are same pattern reused a lot of times. Sadly they aren't in the steam inventory which makes them pretty much worthless, unless you really want to spend money on this game. There are also some hats and banners, which require payment as well.Game offers 4 different game modes: ""Deathmatch"" (team deathmatch), Confrontation, Sabotage (search and destroy/plant the bomb) and Zombiemode (pvp). I mostly found players playing deathmatch, there is very little of them left though.Now the interesting part, especially for a free to play game is that all the guns are bought and reset during the match. There is no inventory where you manage the guns in the lobby, annoying trial guns, p2w weapons or lucky boxes; instead you enter the match and gain 2000 points (depending on game mode) which you can use to buy some guns for start. The more kills you get, more money you gain progressively during the match which you can use to buy new weapons. These points of course reset for every match, so everyone gets a fair start.Gunplay felt lacking for me, the gunsounds were extremely bad, everyone was running around with knife trying to get some easy kills, since all it takes is one knife slice to get a kill. Running is just way too fast for game to be an enjoyable shooter. Most of guns have pretty horrible spread especially when moving, so you are forced to use ironsights which mostly block off your screen making it even harder to hit a target. Or you could try standing still trying to aim with crosshair while others are running to knife you and cheaters are noscope jumpshooting you.Warmode could've been at least a bit better casual shooter if it had any kind of anticheat and if devs didnt completely abandon it. Its only feature is that it isnt p2w, but thats about it. It held me for few minutes just so i could try out all the weapons.Pros:- Not pay to win- Weapons are bought with currency earned during match (works something like counter strike)- 4 game modes- Relatively decent looking cheap skins, available for direct purchaseCons:- No anticheat, cheater infested- Abandoned by developers- Small playerbase- Bad gunplay- Bad gun sounds- Small map pool- Running speed is too fast",0,anger
863,WARMODE,2016,"Early Access ReviewI know I dont have much time played but come on what else is there to do then shoot people. with that said I honestly had fun playing this game. It is very broken in alot of aspects but its early access which HOPEFULLY means its being worked on, right?. I get so used to hearing ""early access"" that it pisses me off. Early access IS for games that are being actively developed and for some players to get a tase of the action before the full game releases and at the same time the players help the devs by finding glitches, bugs, exploits etc. for the devs to correct. Early access IS NOT an excuse for a broken game..... It IS NOT for a bunch of idiots who dont know what they are doing to release a broken piece of♥♥♥♥♥♥for people to download and play for 20 mins before getting bored or pisssed which ever comes first... Spawn killing, knifing(broken), unbalanced weapons, modders, framedrops etc. pick your poision, these are a handfull of the many issues this game has. I doubt this game will be fixed.... like EVER. but I wouldn't mind eating my words on that one. until anything big changes my review will stay unchanged.",0,anger
864,WARMODE,2016,"Early Access ReviewWhat a great game, but I feel as if it is incomplete. Us fans were told about hurricane gameplay and several modes. All we get in the end is a 6-map, linear shooter with a limited user interface. It seems as if mid-development, the creators of the game said, ""Nah, it's good enough."" and left. Which sucks because it a really fun and addicting game. I would say it's a 6/10 rating, but only if you can get past the limited graphics, and limited user interface. Great game, but can be improved.",1,neutral
865,WARMODE,2015,"Early Access ReviewGame is unplayable with multiple monitors. Fullscreen mode or not, the mouse goes outside the window when you try to turn around and as a result when you try to shoot you click out of the game.Have the developers never used a second monitor before? Wow.",0,anger
866,WARMODE,2015,Early Access ReviewPros         easy to pick up and play         not very heavy on the hardware needs        free always a +        large maps        loads of weapon choices        a fair few serverscons well this will be short        too easy to campCSGO has a rival at last.as long as it's kept up to date and they fix the camping spawn problem add some more maps time to time with new game modes this ill take off. ,1,happiness
867,WARMODE,2017,"Early Access Reviewi kinda dont reccomend it because first there is a lot of hackers, second, they dont have an anti cheat to keep those hackers away and third. its just not really a fun game",0,anger
868,WARMODE,2016,"Early Access ReviewThis game is a mix of CoD and CS:GO. The game isn't that bad and it doesn't take much time to get the hang of it because you don't need any skills to play. Some things need to be improved and fixed like the 'Authorization' screen, the spawn camping, add anti cheat system because it's full of hackers and also dying randomly and saying that I was killed by my self. When those little bugs are fixed I will give the game a positive review.12/10 would get killed by my self again",0,boredom
869,WARMODE,2015,"Early Access ReviewWhy bother writing a review for this game? Everyone is on the same boat; this game is terrible.-Takes 30 bullets from an assault rifle to kill an enemy-Laggy af-Mediocre textures-CoD/CS:GO knockoff-Maps are way too small-Another game where the first three letters of the title are WAR-Starting pistol is way too powerfulBut hey, I got to use the uninstall feature for the first time.",0,anger
870,WARMODE,2017,Early Access ReviewPro'sFree Cs:goNot That Bad Graphics Good On Potatoes(my laptop)Con's Alot Of HackersHitboxes Are Glitched I Shoot At A Guys Head No Damage shoot At the Chest HeadshotSome Weapons Are Too OpOtherthere should be a gamemode where the guns are free just saying ,1,neutral
871,WARMODE,2017,Early Access ReviewHave you ever played another fps shooter? If you have you will most likely be at the top of the score board unless they have a blackmodeplayer then he is cheating.,1,happiness
872,WARMODE,2018,"Early Access ReviewWarmode.If you like fps games then DO NOT DOWNLOAD THIS. It takes like 10 or 15 shots to kill some-one, The graphics are really really bad.Pros.1. N/ACons.1. The whole game is a con.This game is a waste of time and disk space.......I am just trying to save you both.First of all it takes about 20 shots to kill a player.Then then guns all just suck!!!!!!",0,anger
873,WARMODE,2016,Early Access Reviewits one of the better Free To Play games because the servers doesnt lag at all and but the bad thing is that there is not so many players. 8/10 Cant wait for the full realease if they will realease it! :(),1,enthusiasm
874,WARMODE,2015,"Early Access Reviewmediocre game, but some real annoying thingswhen you make contact with another player, wheter it be friend or foe, you teleport ontop of his headeven with mouse accel off, it feels like its onknife if glitchy, sometimes it hits sometimes it doesn't. seems random",0,anger
875,WARMODE,2018,"Early Access ReviewFlawless design and stunning gameplay.This sexually arousing offspring of the gaming industry and a dash of cronic H.I.V, highlights the exhilerating experience of playing a CSGO rip off. Both my ♥♥♥♥♥♥ and bladder imploded upon sight of the 1080p graphics. After getting my entire lower half removed and both of my kidneys abducted by a 10 year old cuban doctor, I have since rekindled my grind on WARMODE stopping only when going on violent coughing sprees, like a chain smoker with tuberculosis. An absolute gem.10/10",1,happiness
876,WARMODE,2016,"Early Access ReviewThis game isn't as bad as alot of people say it is.Now, don't bring the torpedos yet, let me explain:This game is full of glitches,bugs,noobs and hackers.To be honest, that's the fun part of it. The randomness of it makes it fun. There isn't really a point on playing it, since you don't get jackshiet from levels, and you have to pay for skins (way to ♥♥♥♥ing stupid for me).But the game overall is worth spending like 20 minutes downloading it with ♥♥♥♥♥♥ internet connection and  is worth it wasting like 5 hours on it.Though there are alot of better games out there to waste time, I waste my time on this one lol.",1,fun
877,WARMODE,2015,"Early Access ReviewCompletely the same as CS:GO but more fun, and also free. Great game to waist time in anticipation for something. Runs well. Find yourself spending hours playing to unlock a beast sniper, and having the round end. Ont the best to play with friends, as teamates do nothing in this game but sit there and steal your kills. 9/10+Free+Better Then CS:GO+Runs Great+A Great Time-Multiplayer Can Be Repetative And Annoying-Same Thing As CS:GO",1,fun
878,WARMODE,2018,"Early Access ReviewThis game i just don't know what to say about this.  It's logic is really flawed, apparently shooting without your iron sights is less accurate than not. There is also A HUGE problem with spawn camping. And it only has like 3 game modes. There is no  variety really, just get killed and continue. OOOOOOOOOOOOOOOOOOH AAAAAAAAAAAAAAAAAAAAA I got spawn killed  this time. Yes my iron sights are Wait? What? Useless. I kept this game to long. At  least I didn't have to pay for it. Don't waste your time.",0,boredom
879,WARMODE,2016,Early Access ReviewI played a bit. This game is too horrible. After just a bunch of minutes of playing I immediately uninstalled. I don't recommend until this game gets better. It has potential but the devs aren't just trying to make it.,0,anger
880,WARMODE,2015,"Early Access ReviewIf you play using DSR or VSR in 4k it doesn't look all that bad.The game feels super call of dutyish with CS elements. If you're somewhat decent at COD 4/MW2 you're going to crush everyone in this game(check my screenshots). THE GAME IS NOT P2W, the microtransactions are all cosmetic. RIght now there isn't much content, I can see this game being somewhat fun to play for an hour. It's 300mb just go ahead and try it.",1,fun
881,WARMODE,2015,Early Access ReviewThis game is a bad rendition of counterstrike.....but its really a rather fun shooter...just something to waste time on really...my bet though is that it wont have a good player base within a month,1,hate
882,WARMODE,2016,Early Access ReviewThis game is not that good to be honest. I like the idea but the way they made it is just awfull but I do believe it can get better. For now I don't recommend it but if it gets better I'll give it another go.,0,anger
883,WARMODE,2017,"Early Access ReviewI recommend this game as a filler, meaning as a break from your main game for a few mins or a hour. Guns are solid, balanced in my eyes. 1Shot sniper ofcourse makes sense since its pretty easy to kill in the game. All but the knife is crazy. KNife will get you the guns you need late game faster than the pistol by default they give you from the start.",1,happiness
884,WARMODE,2016,"Early Access ReviewThis game is good, there ARE hackers yes. But in a game like this it doesnt bug me as much as a game like CSGO or CODsome guns need work; shotguns need more damage (6 shots to chest to kill 1 person :P) as well as some of the assault rifles. Snipers are pretty balanced, without armor is 1 shot, with armor 2 shot, unless headshot then always 1 shotthe graphics are good for a F2P gameITS NOT P2W!? HOLY♥♥♥♥♥♥ A F2P GAME WITH NO P2W! you CAN buy skins, but they are just skins7/10; will make 8 or 9/10 if the guns are fixed and some form of anti-cheat is added",1,happiness
885,Fractured Space,2015,"Early Access ReviewIt's a good game. But the levels are achieved so slow. Spent 3 hours, gained 1 ship... didin't even upgrade it. But don't get me wrong it's is fun to play, but it gets repetative and on some servers if you die you have to wait for some time to respown. But give it a try if you in to space, battle ship fighting etc.",1,boredom
886,Fractured Space,2016,Early Access ReviewThis game has exceeded my expectation for an early access game. The graphics looks great and the gameplay is very decent.  The only annoying part of the game for me was being made to complete a 15minutes tutorial even though the UI is quite self explanatory. I would highly recommend this game to anyone.,1,surprise
887,Fractured Space,2015,"Early Access ReviewALPHA REVIEW:First off, if you're thinking of getting this game, please understand that it is, at its core, a MOBA. (Think LoL in space.) It is however, a very unique MOBA; it is very different from say, LoL or DOTA, and it's not just because it's in space. Right now, there are not very many ships to choose from, but this is likely to change as the game develops. ""Creeps"" or ""minions"" are replaced by stations that have to be captured and ""towers"" are replaced by simple damage taken when you're in range of the enemy base. Upgrades, as of now, consist only of gathering resources from captured stations and gaining a universal upgrade every level gained. This will probably be changed to specific upgrades later. The middle fuel station buff is extremely helpful, so get that when you can. Warping in a fight is dangerous as it leaves you extremely vulnurable to damage. Choose the right time to warp. Teamwork is essential to victory, and this is tied to having a team with balanced ship types. A well coordinated attack can completely turn the tide of a game and to that end, use the warp paths wisely. Controls may seem sluggish or sticky, but this is mostly due to ship stats. This brings up the important point, know your ship! The strengths and weaknesses of each ship are made very clear after a few games. Knowing the capabilities of each ship during a fight can make the difference between wiping the enemy team and a 60 second respawn. The game asks a lot from your computer on the performance end. Lag is also a pretty big problem right now. Connecting to the servers is always a gamble and crashes happen quite frequently. These things are likely to be fixed in timeThe game is still in alpha, so don't expect this to be anything close to the final product. A lot of what I consider cons will likely change later on.TL;DR Pros-ConsPros:+Solid gameplay+Clear strengths and weaknesses between ships and loadouts+Teamwork a must+Great, detailed ship graphics(Alpha)+/- No way to cancel warp jumps (Alpha?)Cons:-High computer performance demand-Crashes 1/5 times (Alpha)-Few ship choices (Alpha)-Disconnect/can't connect to server 1/5 times (Alpha)",1,anger
888,Fractured Space,2015,"Early Access ReviewBig ships in space? Who wouldn't want to dance the slow and deadly dance of cap.ship slugging it out at each other. FS looks good and I didn't run into any bugs first time running it. Lacking any kind of tutorial the learning curve can be a bit harsh, but once you realize how things works it's a big fun. Team work a must in this one. Grab a copy and jump in, just remember that big ships are slow ;)",1,fun
