review_id,title,year,user_review,user_suggestion,emotion
922,Fractured Space,2016,"Only had this game for two days, but really enjoying it.  The tutorial does a very good job of leading you through the controls and how to play the game, and the 3 'starter' ships you begin with are no less capable than any of the other ships, they just have roles which make them easier to play (detection capable scout used in tutorial, a fast attack ship, and a support ship with healing AoE pulse and ability to break enemy armour).  All the ships in game are able to be obtained without spending real money, and the rate at which you can earn them seems pretty quick - there are multiple ships at relatively low cost, across a range of roles including a very tanky battleship, a medic ship with healing beams, a cloaky ambusher, etc.  The ships for the more complex roles will take a bit of time to work towards, but thats probably a good thing as it means by the time you can buy one, you've probably worked out how it could be used.",1,happiness
923,Fractured Space,2016,"Early Access ReviewThis game is beautiful. Such an awesome concept. I was sceptical at first, but this is one of the most enjoyable games in my library right now. As of writing this it is also free to download. DO NOT MISS THIS OPPERTUNITY!",1,happiness
924,Fractured Space,2016,"Early Access ReviewLove the graphics. Didn't have time to experience everything, but haven't seen any major bugs. Although, the game freezes sometimes after I jump to different sectors.",1,happiness
925,Fractured Space,2016,Early Access ReviewJust got into this game yesterday and I have played 13.6 hrs and plan to play a whole lot more..It takes a while to get the hang of but once you do you just want to keep playing.....Cant wait to see the full game.,1,enthusiasm
926,Fractured Space,2015,"Early Access ReviewA New Face for Early Access?When most people hear ""Early Access"" in a game's description, what do they think? ""Shoddy, unfinished, unpolished, cash-grab.""Fractured Space is an Early Access game, and without a doubt it blows those stereotypes out of the water (or would that be asteroid belt?)As an Early Access game, FS stands out with its beautifully polished content, but suffers from a lack thereof. What's in the game (as of the time of writing) is phenomenal, but one can't help shake the feeling that it's an empty frame - beautifully crafted - waiting for something to fill the void.However, do not take this as a negative. The relatively small amount of content that exists in the game is still enough to keep a player occupied! Upgrade costs are balanced in such a way that players can look forward to tweaking their loadout with a new gimmick after every match, or hold out for a few more and get an entirely new ship.With a pace that shifts from relaxed to blistering at a moment's notice, the game itself is stunning, breathtaking, and incredibly fun to play. There's something magical about drifting in calm silence to let your ship repair one moment, then warping in to a hurricane of shrapnel and broadside fire the next. Fractured Space truly captures the mix of nerve-wracking tactics and frenetic action that real space combat would be - and wraps it up in an intuitive, easy-to-learn package.The assets are absolutely gorgeous and the atmosphere is incredibly well thought-out. Ship design seems to take cues from modern popular Sci-Fi as well as the classic Hard Science Fiction of the 20th century. The first time I clapped eyes on the game's ""Flagship"" heavy cruiser, I felt the spirit of Robert A. Heinlein become one with my own and we both giggled uncontrollably for several minutes from sheer glee.Fans of War Thunder and other tactical vehicle-based team warfare games would be well-advised to pick this gem up ASAP. ",1,happiness
927,Fractured Space,2015,"Early Access ReviewDo you like MOBA gameplay such as  DOTA 2, LEAGUE OF LEGENDS, HON and other similar games?But you also like BIG♥♥♥♥♥♥♥♥♥ING SPACESHIPS WITH BIG♥♥♥♥♥GUNS SHOOTING FIERY BALLS OF DOOM AND LASORS AT OTHER SPACESHIP?THAN THIS IS THE GAME FOR YOU, WAIT NO LONGER AND INSTALL NOW!!Basicly you're going 5 vs 5 with a spaceship of your choice, capturing points  and eventually trying to capture the enemy base. The more points you capture the more resources you gain per second, and resources mean upgrades to your ships health and damage, giving you advantage over  the enemy ships. Currently you can choose between 15 or something ships (but this is still alpha, more ships to come for sure), you got  tanky ships, high damage ships, long range ships, close range attack ships, assasin ship (like you go in stealth mode, pop up next to enemy ship, do a lot of damage and then get the hell out of there), support ships (repair yourself and allies, or increase damage done on enemy ships for you and your allies.) and some mixed ships that have a little of everything.I can only say that i've liked this game so far, there are some downsides like laggy servers ( like 1 in 5 games for me are laggy, and 1 in 15 or so is like almost unplayable due to lagg), but that is what you get when you play alpha release. other downside is that currently it is impossible to change the controls for the game (unless you alter some files) which is really anoying if you are one of the few people (belgium,france, ...) that use AZERTY keyboards, because the controls are for QWERTY which means you control the ships movement with ZQSD instead of WSAD. You can fix this by pressing alt+Lshift to switch your keyboard to qwerty mode, but than you will not be able to type properly.  All in all, great game, I am sure they will fix these problems in the near future, and when the game goes full release there will most likely be more ships and maps  and modes to play.I rate it  7.5/10",1,happiness
928,Fractured Space,2015,Early Access ReviewWell yeah nice........................................kekReally it great. Just that not many people know about it [ when I mean know about it is played it not just watch some random dude or dudate play hahaha]and that blink,1,happiness
929,Fractured Space,2015,"Early Access ReviewI bought this when it was only a couple weeks old on steam. It was choppy and unoptimised, to the point where I was getting 0 FPS in combat situations. After a couple of months of neglect I came back to find the game patched several times fixing the issues I was having. Great cap ship combat for those looking for a game!",1,happiness
930,Fractured Space,2015,"Early Access ReviewThis game is absolutely awesome. It allows you to play in those space battle with huge ship that I always fantasized about. This is an early access that needs some polishing here and there, but it is mostly there.",1,happiness
931,Fractured Space,2015,"Early Access ReviewA tactical space MOBA of sorts, with a real depth and potential for even more greatness. Plus the devs are really open and communicative, which makes it easy to see this game is going to be fantastic.",1,happiness
932,Fractured Space,2016,"Early Access ReviewVery fresh approach to MOBA genre with popular cosmetic micro transactions system (absolutely no pay 2 win). Easy to get into, but hard to master. Also very competitive and visually stunning. Worth trying out. Big thumbs up!",1,happiness
933,Fractured Space,2016,"Early Access Reviewlove the but the weekend deal is overloading their servers.  I will assume that will be fixed in time.  The way they use xp as a currancy prevents ""Pay to Win"".  Look forward to more in the future.",1,happiness
934,Fractured Space,2016,"Early Access ReviewI picked up Fractured Space during the free weekend last week, and these are my thoughts after 3-4 days of playing it.Fractured Space is a very interesting and promising space combat game that combines A MOBA and World of Warships with a space age aesthetic. This game is relatively easy to get into, even for someone who generally dislikes MOBA's, such as I. The objective of each game is to capture the enemy base while vying for control of two lanes and a middle sector. You capture up to three mining stations to gain resources for your team. Resources are used to upgrade your ships, and the upgrade level of your fleet makes a huge difference in combating other players and capturing the enemy base. There is also the middle area, called the Gamma Sector. This is a large station that when captured by a team, gives the whole team a big damage buff, making pushes much easier to accomplish. Teamwork is a major part of this game, and this is made more obvious when you look at the variety of ships available. It almost reminds me of a class based shooter, like Team Fortress 2. You have your basic front line attack ships, the super massive defensive ships, and the support and healer ships. Any player can find a role and a ship that fits their play style the most. No ship is outright better then the other, which is a huge sigh of relief in a word of pay-2-win F2P games. Graphics are quite impressive in this game, though there are some minor rough spots here and there. The skyboxes are beautiful, distant planets look amazing, and the ships themselves are loaded with detail. The ships are the highlight of the audio-visual experience for me, looking like something a real company would make. They also sound great, weapons sound punchy and dangerous, and the warp drive really does sound how you'd imagine massive hyperspace engines would sound like. Though graphics can be a bit uneven in places, especially on asteroids. But as you're usually just flying by them, it won't bother you that much. There is also occasionally texture pop-in when warping into different lanes. But overall, graphics are sound are great.Gaining new ships and weapon in Fractured Space is a process of gaining experience in one of the three ship manufacturers in the game by using their ships, and making credits, which you gain after each round. It took me only a couple matches to unlock the first ship after the starter ship, and one more day to unlock the one after that. You can speed up the process by purchasing a microtransaction only currency and buying the ship with that, but you still need to unlock the ship with actual play time. And as no ship is a direct upgrade over the other, I find this very fair.Speaking of microtransactions, they are done very well in Fractured Space. The only exclusive things you can buy are ship skins and credit and XP boosters to use after the match, along with being able to purchase weapons and crew members (five stat boosters you can buy to improve your ship even more) faster. You can still buy these with credits, although it will take you longer. I think this system is totally fair and encourages people to invest in the game if they like it.My only real gripes with the game come from its Alpha, Early Access status. Matchmaking can sometimes not work, lag can playing borderline impossible, warping sometimes doesn't work, and general wonkiness and UI weirdness crops up. But all these things are being worked on by the devs, and the game isn't even in Beta yet. This game has a ton of potential, and I really hope that this game garners a large following in the very near future. Until then, I'll see you in the Gamma Sector while getting shot down by a Brawler.  ",1,happiness
935,Fractured Space,2016,"Early Access ReviewWhile matchmaking is still being worked on, I can honestly say that the connection quality has shown some improvements, and I'm hopeful for the future. While it lacks the intense customization of games like DotA and LoL, it's current game format heavily resembles the balancing act that is involved with those games. Controlling stations gains you resources which level your team up, the more stations you control on the map, the faster you level, which in turn strengthens your teams ships. However, killing isn't the goal in this game, rather the capture of enemy forward bases to open the way for your team to capture their home base. Capturing stations will net you more resources, but also will signal to the enemy which sectors you're advancing on and where they should divert more ships to counter. There's a small series of tutorial missions that will enable you to get a sense of the basic mechanics of the game and how to move about, but it's up to you to get an idea of the tactics and strategy. There's currently three factions of ships, each with their own unique classes and abilities, so there's plenty of variety in the different ship classes, and there is also the chance to further tweak your ships through the uses of different crews and weapons. The game is slated to become Free-to-Play when it exits Early Access (may even be free now, not 100% sure) but, assuming there aren't any significant tweaks to the EXP and Credit rewards, the spectre of 'grind' doesn't seem to loom heavily as I've managed, as a rookie, to get around 1k of experience each game, making new ships availible every dozen games or so depending on my performance. Money will help unlock things faster, but the only things money can exclusively buy amount mostly to new skins for ships. It also helps that it scratches that capital ship itch. You know the one, the desire to maneuver a massive ship to bring an earth-shattering arsenal to bear on the enemy...",1,neutral
936,Fractured Space,2016,"Early Access ReviewAbsolutely Great game with good graphics and fun combat... only downside (and what killed it for me) is that matchmaking is horrible, as I found myself grouped with teammates who didn't know what they should be doing, and enemy teams with 2000+ more matchmaking points than the team I was on, even being in a lobby with a friend (who is about the same level as me) did nothing to help.I'd love to see these things fixed, but untill they are, I sadly cant give this game more than a 6/10",1,neutral
937,Fractured Space,2016,"Early Access ReviewWell everything already good about the game from landscape till the bases and the ships need to be more upgraded or should be more ship for every faction. The detail is so amazing but,should add more damage condition like engine problem or weapon jammed and that kind of poblem is needed on this kind of gameBut i still recomomend this game that love space adventure",1,happiness
938,Fractured Space,2016,"Early Access ReviewFractured space has been a fun game, If you want a storyline Go to another game, This is a very good Strategy game and has had me playing for hours, The only thing that i would change is add a lore. Idk what we are fighting over! it might just be who stole whos oreos. 10/10 potatos would recommend",1,fun
939,Fractured Space,2016,"Early Access ReviewI will keep this sweet and short,  its a solid space moba light. with friends, its alot of fun, solo it can get frustrating at times but is still playable. the comunity is one of the least toxic and most helpful out their. and even if your playing at the highest level, there is alot of fun to be had.the only problem I have with this game is that they call it a alpha, in many ways its more pollished then any proper alpha I have ever seen,  being what it is however, its pretty good, but I want the devs to take even more pride in the work they did.the game is a bit fps intensive if you dont have good gpu (unreal engine) but is still playable for most ships.  there are a few which I do not recomend for beginner like the raven, raider, and ranger. but most of the other ships are playable if they have enough skill.lastly, devs are nice and funny.",1,fun
940,Fractured Space,2016,"Early Access ReviewSo far my favorite game. Graphics are beautiful, controls are easy to use and unlike some people think it's not pay to win. Even buying the most expensive ship doesn't mean you have a ship that better then someone using a starter ship. That's one thing I love about this game.",1,happiness
941,Fractured Space,2016,"Early Access ReviewThis game is only in Alpha stages and I t hink it's beautiful :). Yes I only played for a few minutes but it was enough time for me to have a look at the graphics and play around with the ship, I thought the controls were nice and e asy to use, effects are cool :)I would recommend giving this game a go :)",1,happiness
942,Fractured Space,2016,"Im blown away by this game, the details of every ship is not something to be taken for granted, i usually have this sort of personal hate towards MOBA games because they usually turn out salty af, this game is not the case and i actually enjoy myself, its slow paced in a way but hey, those are huge ships.recommend it to anyone with a tactical view of playing games:)",1,happiness
943,Fractured Space,2016,"Early Access ReviewI was going to breakdown everything in the game but wont bother and will keep it simple (although still longer than i expected):My opinion: Solid gameplay with no game breaking issues that ive come across yet. Only had some weird issues with the matchmaking but its not frequent enough to be too bad.  If played with an organized group, this game could excel even more, but still fun playing solo and most people do at this point. If you can get it free (weekend special as of posting) or on sale, and your remotely interested in this game, get it. The devs have shown they can develop it into a decent game.  The negatives are in the fact this game is still being developed, and needs some more variety in gameplay/maps. But really my negatives are limited to that and I do believe the devs have shown interest in properly developing this game and adding more additions.  I suppose a second lesser negative is directed towards Sci-fi junkies, if you observe the ships at face value they seem fine. But when you read the details they add things like the # of crew, which is cool, but its done very arbituarily. A lot of the ships looks like they are made of sheets of metal housing some bare bones weapon infrastructure inside. If anything they appear to be remotely controlled behemoths (and most actually appearing to be thinly defended by said sheets of metal), so I find it difficult to make out where exactly the crew on these ships live/move around/operate. Additionally, the physics of ship movement dont add up with what is graphically displayed. If i use thrusters to go upwards, and then stop using them, which passively levels my ship, what I see is the nose of the ship going up (with thrusters below the nose clearly pushing it, and the main thrusters at the back of the ship giving forward momentum), but then upon stopping my movement and evening back down there are no thrusters above the ship trying to even my ship out. This isnt correct as there is no gravity, and if my ship evens out thrusters at the top should be visibily attempting to level out my ship. Of course we can try and derail this critique by my use of leveling out, and upwards, and the fact its in space, but you know what i mean that has nothing to do with the graphics being incorrect.  Since scifi junkies are likely to be the ones most immersed in this kind of game, its important to have those aspects correct.Microtransactions: Limited to skins essentially, you CAN'T simply buy a ship to unlock and use it. There is a little more detail to provide in this regard but i wont bother, just know that microtransactions are heavily limited and you wont see people with more money winning. Every ship has its pros and cons too, so even if they could, not like that means they'd be the best.",1,neutral
944,Fractured Space,2016,"Early Access ReviewThis is a great game, one of the bests I've ever played. It gathers the best of the MOBA universe (the importance of positioning, map awareness, knowing how to push and where jumping across sectors) and the intensity of games as World of Tanks or World of Warships. The ships are really well designed and the variety of playstyles feels very nice. I totally recommend this game.",1,happiness
945,Fractured Space,2016,"Early Access ReviewNever played a space game quite like it, original concept MOBA/Space shooter. good graphics, runs well and has some variety and customisation. I'll be playing this one again for sure.",1,happiness
946,Fractured Space,2016,"Early Access ReviewI played this game quite a while back for a bit, believed it to be decent, but lacking. I have to say the game has come quite some ways, but it is still in need of more quality of life improvements.The good:*Good preformance running 3770K and 980.*Not grindy no stepping up of this ship is better they are simply different.*Gameplay flow is good, slow enough to be tactical and fast enough to be fun.*Ships truly are different and forfil different roles within the game and just just this is a healbot ship and this one does damage. They all have their prefered way of playing so once you are in you will find the ships that suit your playstyle. The bad:*Pricing feels high on the micro transaction they are boarderline macro in my opinion and this is not a problem unique to this game. *Lacks a quick communicate option like a command tree where you can with 2-3 button presses ask for support, order an attack etc etc etc. Such a system would be helpful in public matches and specially give new players and idea of what to do. *Bit more feedback on what just nuked you would be nice, sometimes you can really go from being just fine to death in seconds a bit of a what happened would be ideaal to help you learn, again quality of life. The ugly: *Match making is unsure of itself it feels, 1 match is very quick and the next one just will not show up. This makes it quite annoying to play because there is also no indication of why things take longer. So if there are very few players communicate this, that way it is still bad, but not frustrating.Overal I would recommend this game to those who like big space ships and moba style games as that is what it is a moba with capital space ships.",1,happiness
947,Fractured Space,2015,"Early Access ReviewI don't understand why not many people play this game. It's a very strong game that has already enough content to hold on it's 10E pricetag, physics are really great, the engine choice is great, graphics are great, it runs smooth and it has bling-bling effects, and after all it's a medium scale space battle game, who doesn't love space battles?EDIT: I forgot to the add the fact that for some reason this game has like ~140 players online usually (which as I said is odd :( ) around all the time but the devs still develop it at a good rate.",1,happiness
948,Fractured Space,2015,"Early Access ReviewThis game is not bad; It feels like an interstellar version of ""World of Warships"" with large amount of strategy element, but they need to optimize it even further, it's been a year since the launch, so I think this can be eliminated rather easily.All in all I'm willing to give it 9/10. -1 due to bad optimization/low FPS in the hanger; say, what can be better when you can actually fight with a member from the development company?",1,happiness
949,Fractured Space,2015,"Early Access ReviewMost epic space game I've seen in a long time...And the fact that its still in Alpha makes it all so much better, cant wait to see the final release.Things this game lacks: -Customization (Yea ik,its still in alpha,but still)                                        -Players & Servers                                         -Wide variety of mapsWhat makes this game great:-Epic space battles                                                 -Huge teamwork needed                                                  -Awesome ships with different playstyles each ",1,happiness
950,Fractured Space,2015,"Early Access ReviewI've only played a few matches, but it has tons of potential and is very polished for an early access game! Most importantly, the sci-fi is cool, ships are cool, and its fun!",1,happiness
951,Fractured Space,2015,"Early Access ReviewI dont know when i bought this game or how it got into my inventory but its amazing.  If you play world of warships, looking forward to dreadnaught, or like big ships and big guns then give this game a try.",1,happiness
952,Fractured Space,2015,"Great Game. Definetly deserves more players, so if you have some money to spare come and join the epic space battles :D.It is still in alpha but almost feels like a finished game (still some placeholders ingame but they also look awesome :D).",1,happiness
953,Fractured Space,2016,"Early Access ReviewGet on this...Good space, shooty, action without the boring♥♥♥♥♥♥(eg. love interest, imaginary cyborg babes, cheesy plot, mandatory love triangle space opera...wait...can we get imaginary cyborg babes cause that would be cool...)",1,happiness
954,Fractured Space,2016,"Early Access ReviewThis game really is fun. Sure it is ruff around the edges but what EARLY ACCESS game isnt? They defintely need to add some more maps to pick from and of course more ships and gear is always awesome. Very simple you pick a ship get locked in with a team and fight to capture each others bases. Alot funner then you might think, so ya I recommend this game as it has HUGE growth potential. 2v2 player maps 3v3 player maps, different space areneas to fight in, weapons upgrades and whats with that first video? I would love to be able to go in my cockpit. The growth is there so keep it up guys. Also read alot of reviews about it not connecting to people? When I play I usually see 1k-2k playing and it links up most often in under 2min. Anyway I dont get what all the pointless complaints are about since everybody should know this game is not completed yet. Keep it up guys!",1,fun
